{
  "id": "nhl:wsh",
  "slug": "wsh-capitals",
  "name": "Вашингтон Кэпиталз",
  "nameEn": "Washington Capitals",
  "short": "WSH",
  "country": "USA",
  "city": "Washington",
  "conference": "Восточная",
  "division": "Столичный",
  "founded": 1970,
  "arena": {
    "name": "Вашингтон Кэпиталз Арена",
    "capacity": 18500,
    "city": "Washington"
  },
  "colors": [
    "#00205B",
    "#C0C0C0"
  ],
  "logo": "/assets/logos/teams/wsh.svg",
  "coach": "Главный тренер",
  "roster": [],
  "competitions": [
    "NHL"
  ]
}