{
  "id": "nhl:phi",
  "slug": "phi-flyers",
  "name": "Филадельфия Флайерз",
  "nameEn": "Philadelphia Flyers",
  "short": "PHI",
  "country": "USA",
  "city": "Philadelphia",
  "conference": "Восточная",
  "division": "Столичный",
  "founded": 1970,
  "arena": {
    "name": "Филадельфия Флайерз Арена",
    "capacity": 18500,
    "city": "Philadelphia"
  },
  "colors": [
    "#00205B",
    "#C0C0C0"
  ],
  "logo": "/assets/logos/teams/phi.svg",
  "coach": "Главный тренер",
  "roster": [],
  "competitions": [
    "NHL"
  ]
}