{
  "id": "nhl:ana",
  "slug": "ana-ducks",
  "name": "Анахайм Дакс",
  "nameEn": "Anaheim Ducks",
  "short": "ANA",
  "country": "USA",
  "city": "Anaheim",
  "conference": "Западная",
  "division": "Тихоокеанский",
  "founded": 1970,
  "arena": {
    "name": "Анахайм Дакс Арена",
    "capacity": 18500,
    "city": "Anaheim"
  },
  "colors": [
    "#00205B",
    "#C0C0C0"
  ],
  "logo": "/assets/logos/teams/ana.svg",
  "coach": "Главный тренер",
  "roster": [],
  "competitions": [
    "NHL"
  ]
}