{
  "id": "nhl:cbj",
  "slug": "cbj-blue-jackets",
  "name": "Коламбус Блю Джекетс",
  "nameEn": "Columbus Blue Jackets",
  "short": "CBJ",
  "country": "USA",
  "city": "Columbus",
  "conference": "Восточная",
  "division": "Столичный",
  "founded": 1970,
  "arena": {
    "name": "Коламбус Блю Джекетс Арена",
    "capacity": 18500,
    "city": "Columbus"
  },
  "colors": [
    "#00205B",
    "#C0C0C0"
  ],
  "logo": "/assets/logos/teams/cbj.svg",
  "coach": "Главный тренер",
  "roster": [],
  "competitions": [
    "NHL"
  ]
}