{
  "id": "nhl:cgy",
  "slug": "cgy-flames",
  "name": "Калгари Флэймз",
  "nameEn": "Calgary Flames",
  "short": "CGY",
  "country": "CAN",
  "city": "Calgary",
  "conference": "Западная",
  "division": "Тихоокеанский",
  "founded": 1970,
  "arena": {
    "name": "Калгари Флэймз Арена",
    "capacity": 18500,
    "city": "Calgary"
  },
  "colors": [
    "#00205B",
    "#C0C0C0"
  ],
  "logo": "/assets/logos/teams/cgy.svg",
  "coach": "Главный тренер",
  "roster": [],
  "competitions": [
    "NHL"
  ]
}