{
  "id": "nhl:stl",
  "slug": "stl-blues",
  "name": "Сент-Луис Блюз",
  "nameEn": "St. Louis Blues",
  "short": "STL",
  "country": "USA",
  "city": "St. Louis",
  "conference": "Западная",
  "division": "Центральный",
  "founded": 1970,
  "arena": {
    "name": "Сент-Луис Блюз Арена",
    "capacity": 18500,
    "city": "St. Louis"
  },
  "colors": [
    "#00205B",
    "#C0C0C0"
  ],
  "logo": "/assets/logos/teams/stl.svg",
  "coach": "Главный тренер",
  "roster": [],
  "competitions": [
    "NHL"
  ]
}