{
  "id": "nhl:min",
  "slug": "min-wild",
  "name": "Миннесота Уайлд",
  "nameEn": "Minnesota Wild",
  "short": "MIN",
  "country": "USA",
  "city": "Minnesota",
  "conference": "Западная",
  "division": "Центральный",
  "founded": 1970,
  "arena": {
    "name": "Миннесота Уайлд Арена",
    "capacity": 18500,
    "city": "Minnesota"
  },
  "colors": [
    "#00205B",
    "#C0C0C0"
  ],
  "logo": "/assets/logos/teams/min.svg",
  "coach": "Главный тренер",
  "roster": [],
  "competitions": [
    "NHL"
  ]
}