{
  "id": "nhl:nyi",
  "slug": "nyi-islanders",
  "name": "Нью-Йорк Айлендерс",
  "nameEn": "New York Islanders",
  "short": "NYI",
  "country": "USA",
  "city": "NY Islanders",
  "conference": "Восточная",
  "division": "Столичный",
  "founded": 1970,
  "arena": {
    "name": "Нью-Йорк Айлендерс Арена",
    "capacity": 18500,
    "city": "NY Islanders"
  },
  "colors": [
    "#00205B",
    "#C0C0C0"
  ],
  "logo": "/assets/logos/teams/nyi.svg",
  "coach": "Главный тренер",
  "roster": [],
  "competitions": [
    "NHL"
  ]
}