{
  "id": "nhl:lak",
  "slug": "lak-kings",
  "name": "Лос-Анджелес Кингз",
  "nameEn": "Los Angeles Kings",
  "short": "LAK",
  "country": "USA",
  "city": "Los Angeles",
  "conference": "Западная",
  "division": "Тихоокеанский",
  "founded": 1970,
  "arena": {
    "name": "Лос-Анджелес Кингз Арена",
    "capacity": 18500,
    "city": "Los Angeles"
  },
  "colors": [
    "#00205B",
    "#C0C0C0"
  ],
  "logo": "/assets/logos/teams/lak.svg",
  "coach": "Главный тренер",
  "roster": [],
  "competitions": [
    "NHL"
  ]
}